{"schemaVersion":"1.0.0","slug":"swat-vs-zombies","engine":"other","runtimeClass":"static","discoveredAt":"2026-08-01T00:00:00.000Z","packages":[{"kind":"build","relativePath":"private-ingress/swat-vs-zombies.zip","sha256":"e81b265da331ebe0ff0a2047200eebc2e1a20044e2d841f9a5ea42ba0b9fb129","bytes":86495953,"fileCount":0,"archiveState":"local-only","vaultKey":null}],"reviewableSource":{"state":"pending","shard":"game-source-other-01","path":"games/swat-vs-zombies/","blockedReason":null},"provenance":{"sourceOwner":null,"rightsReference":"RIGHTS-PENDING-SWAT-VS-ZOMBIES","inventoryReference":"PILOT-INGRESS-SWAT-VS-ZOMBIES","notes":"Exact deployable ZIP digest recorded; source-engine classification and rights evidence remain pending."}}
