{"schemaVersion":"1.0.0","slug":"robotex","engine":"other","runtimeClass":"static","discoveredAt":"2026-08-01T00:00:00.000Z","packages":[{"kind":"build","relativePath":"private-ingress/robotex.zip","sha256":"4bc0f1cb49db2c22ece93acd3e8c563cceb9d267c10ea0efa7a488e365904bf7","bytes":40401437,"fileCount":0,"archiveState":"local-only","vaultKey":null}],"reviewableSource":{"state":"pending","shard":"game-source-other-01","path":"games/robotex/","blockedReason":null},"provenance":{"sourceOwner":null,"rightsReference":"RIGHTS-PENDING-ROBOTEX","inventoryReference":"PILOT-INGRESS-ROBOTEX","notes":"Exact deployable ZIP digest recorded; source-engine classification and rights evidence remain pending."}}
