{"schemaVersion":"1.0.0","slug":"duck-hunter","engine":"other","runtimeClass":"static","discoveredAt":"2026-08-01T00:00:00.000Z","packages":[{"kind":"build","relativePath":"private-ingress/duck-hunter.zip","sha256":"33864d4654a9c7e96f1d073159b9fbcbc8df5f81c167530eca4575dfb08638c5","bytes":31974209,"fileCount":0,"archiveState":"local-only","vaultKey":null}],"reviewableSource":{"state":"pending","shard":"game-source-other-01","path":"games/duck-hunter/","blockedReason":null},"provenance":{"sourceOwner":null,"rightsReference":"RIGHTS-PENDING-DUCK-HUNTER","inventoryReference":"PILOT-INGRESS-DUCK-HUNTER","notes":"Exact deployable ZIP digest recorded; source-engine classification and rights evidence remain pending."}}
