{"schemaVersion":"1.0.0","slug":"ranger-vs-zombies","engine":"other","runtimeClass":"static","discoveredAt":"2026-08-01T00:00:00.000Z","packages":[{"kind":"build","relativePath":"private-ingress/ranger-vs-zombies.zip","sha256":"b9b62c7835030049affe3b0989a2bce8bcca518e58d3b5436b7c24f93d3aeb1e","bytes":29933802,"fileCount":0,"archiveState":"local-only","vaultKey":null}],"reviewableSource":{"state":"pending","shard":"game-source-other-01","path":"games/ranger-vs-zombies/","blockedReason":null},"provenance":{"sourceOwner":null,"rightsReference":"RIGHTS-PENDING-RANGER-VS-ZOMBIES","inventoryReference":"PILOT-INGRESS-RANGER-VS-ZOMBIES","notes":"Exact deployable ZIP digest recorded; source-engine classification and rights evidence remain pending."}}
